[
  {
    "id": "provider-openai",
    "slug": "openai",
    "name": "OpenAI",
    "provider": "OpenAI",
    "status": "active",
    "scope": [
      "OpenAI API message design where developer instructions, user input, and retrieved evidence must remain distinguishable.",
      "Structured Outputs, function calling, and eval-driven prompt changes used by an application."
    ],
    "out_of_scope": [
      "ChatGPT product-plan behavior, workspace administration, and undocumented interface features.",
      "Claims that one prompt behaves identically across every current or future OpenAI model."
    ],
    "official_source_ids": [
      "official-openai-prompt-engineering",
      "official-openai-structured-outputs",
      "official-openai-function-calling",
      "official-openai-evals"
    ],
    "supporting_source_ids": [],
    "stable_guidance": [
      "Place policy and application rules in developer instructions, then pass the end user's request as user input.",
      "Use a response schema when application code requires typed fields, and validate field meaning after schema conformance.",
      "Run prompt or schema changes against stored cases and graders before replacing the production version."
    ],
    "provider_specific_guidance": [
      "Treat Structured Outputs and JSON mode as different contracts; schema adherence is the relevant choice when typed output is required.",
      "Describe each function's business preconditions in its tool definition, but let application code execute and authorize the call.",
      "Keep evaluation cases, graders, and prompt versions connected so regressions are attributable to a specific change."
    ],
    "fast_stale_areas": [
      {
        "area": "Instruction-role and model-specific prompting recommendations",
        "why_stale": "The prompt guide can change as model families and recommended controls evolve.",
        "source_id": "official-openai-prompt-engineering",
        "last_verified": "2026-07-31"
      },
      {
        "area": "Supported Structured Outputs schema surface",
        "why_stale": "Supported schema features and model coverage are provider-versioned behavior.",
        "source_id": "official-openai-structured-outputs",
        "last_verified": "2026-07-31"
      },
      {
        "area": "Function-calling parameters and strict-mode behavior",
        "why_stale": "Tool controls and schema requirements can change with the API surface.",
        "source_id": "official-openai-function-calling",
        "last_verified": "2026-07-31"
      }
    ],
    "remaining_gaps": [
      "This repository has not executed the examples against multiple OpenAI model snapshots.",
      "Latency, token use, and grader agreement have not been measured for the fictional support-triage workflow."
    ],
    "acceptance_criteria": [
      "The sample keeps developer policy separate from the fictional customer message.",
      "The production workflow validates both Structured Outputs conformance and cited ticket evidence.",
      "Any function call remains subject to application authorization and is not treated as permission granted by the model."
    ],
    "last_verified": "2026-07-31",
    "stale_after_days": 60,
    "stale_risk": "high"
  },
  {
    "id": "provider-anthropic",
    "slug": "anthropic",
    "name": "Anthropic Claude",
    "provider": "Anthropic",
    "status": "active",
    "scope": [
      "Claude API prompt iteration that begins with task-specific success criteria and an evaluation set.",
      "Claude tool definitions and Claude Code prompt-library examples used within their documented product surfaces."
    ],
    "out_of_scope": [
      "Undocumented Claude model differences, beta controls, subscription limits, or live product availability.",
      "Treating a Claude Code workflow prompt as a universal system prompt for unrelated Claude API applications."
    ],
    "official_source_ids": [
      "official-claude-prompting-overview",
      "official-claude-tool-use",
      "official-claude-code-prompts"
    ],
    "supporting_source_ids": [],
    "stable_guidance": [
      "Define observable success criteria and representative failures before choosing a prompt technique.",
      "Separate reference material from instructions with explicit boundaries and allow an insufficient-evidence outcome.",
      "Give tools narrow descriptions and schemas so tool selection can be evaluated independently from answer prose."
    ],
    "provider_specific_guidance": [
      "Use the Claude prompting workflow to diagnose whether the failure belongs to prompting, model selection, or missing application context.",
      "For client tools, execute the requested operation outside the model and return a bounded result in the next message.",
      "Apply Claude Code prompt-library patterns only after preserving their coding-agent context and review checkpoints."
    ],
    "fast_stale_areas": [
      {
        "area": "Claude prompting techniques and model-selection boundaries",
        "why_stale": "The overview is revised alongside Claude model capabilities and recommended techniques.",
        "source_id": "official-claude-prompting-overview",
        "last_verified": "2026-07-31"
      },
      {
        "area": "Tool schema options and client-versus-server tool behavior",
        "why_stale": "Tool types, strict schema support, and execution responsibilities are active API features.",
        "source_id": "official-claude-tool-use",
        "last_verified": "2026-07-31"
      },
      {
        "area": "Claude Code prompt-library tasks and product workflow",
        "why_stale": "Coding-agent commands and supported workflows can change independently of the Claude API.",
        "source_id": "official-claude-code-prompts",
        "last_verified": "2026-07-31"
      }
    ],
    "remaining_gaps": [
      "No live comparison has established whether the example's evidence labels are stable across Claude model generations.",
      "Claude Code examples were reviewed as product documentation but were not executed inside a repository session."
    ],
    "acceptance_criteria": [
      "The document-review example has an explicit abstention path when the supplied policy lacks an answer.",
      "Tool evaluation distinguishes correct tool choice from valid application-side execution.",
      "A Claude Code-derived technique is labeled product-specific instead of being generalized to every Claude surface."
    ],
    "last_verified": "2026-07-31",
    "stale_after_days": 60,
    "stale_risk": "high"
  },
  {
    "id": "provider-google",
    "slug": "google",
    "name": "Google Gemini",
    "provider": "Google",
    "status": "active",
    "scope": [
      "Gemini API prompts that combine text with image or document evidence and require explicit source priority.",
      "Gemini Structured Outputs and function declarations used for typed extraction or application tools."
    ],
    "out_of_scope": [
      "Vertex AI product configuration, regional availability, pricing, quotas, and certification guidance.",
      "Unverified assumptions about media limits, thinking behavior, or feature parity across Gemini models."
    ],
    "official_source_ids": [
      "official-gemini-prompting",
      "official-gemini-structured-output",
      "official-gemini-function-calling"
    ],
    "supporting_source_ids": [],
    "stable_guidance": [
      "Assign each media item a purpose and define what to do when visual evidence is unreadable or conflicts with text.",
      "Use a response schema for extraction, while retaining semantic validation for values the schema cannot prove.",
      "Test both tool-call and no-tool paths because application code, not the model, performs the external operation."
    ],
    "provider_specific_guidance": [
      "Order multimodal parts deliberately and refer to the relevant image or document unambiguously in the instruction.",
      "Design Structured Outputs against Gemini's documented JSON Schema subset rather than assuming arbitrary schema support.",
      "Translate a Gemini function call into an authorized application action, then provide only the necessary result back to the model."
    ],
    "fast_stale_areas": [
      {
        "area": "Gemini multimodal prompting recommendations",
        "why_stale": "Supported media behavior and recommended prompt patterns evolve with Gemini capabilities.",
        "source_id": "official-gemini-prompting",
        "last_verified": "2026-07-31"
      },
      {
        "area": "Gemini Structured Outputs schema subset",
        "why_stale": "Schema keyword support and compatible models are versioned provider behavior.",
        "source_id": "official-gemini-structured-output",
        "last_verified": "2026-07-31"
      },
      {
        "area": "Function-calling modes and composition",
        "why_stale": "Function-calling controls and supported combinations can change in the API.",
        "source_id": "official-gemini-function-calling",
        "last_verified": "2026-07-31"
      }
    ],
    "remaining_gaps": [
      "The image-plus-invoice example has not been run against Gemini with degraded or rotated scans.",
      "This repository has not measured portability between Gemini Structured Outputs and another provider's schema subset."
    ],
    "acceptance_criteria": [
      "The invoice workflow reports unreadable visual regions instead of inventing field values.",
      "Every extracted amount is checked against the declared Gemini response schema and a business-rule validator.",
      "The delivery-status function cannot expose another fictional account because authorization occurs outside the prompt."
    ],
    "last_verified": "2026-07-31",
    "stale_after_days": 60,
    "stale_risk": "high"
  },
  {
    "id": "provider-microsoft",
    "slug": "microsoft",
    "name": "Microsoft Azure OpenAI and Copilot",
    "provider": "Microsoft",
    "status": "active",
    "scope": [